{
  "$schema": "./registry.schema.json",
  "name": "rust-kernels",
  "version": 2,
  "description": "Reusable Rust algorithms and data structures that can be consumed as crates or integrated as source.",
  "source": {
    "repository": "https://github.com/moritzbrantner/rust-kernels",
    "revisionType": "git-commit"
  },
  "provenance": {
    "schema": "https://raw.githubusercontent.com/moritzbrantner/rust-kernels/main/provenance.schema.json",
    "lockFile": ".rust-kernels.lock.json"
  },
  "items": [
    {
      "name": "spatial-kernels",
      "type": "registry:crate",
      "title": "Spatial Kernels",
      "description": "Deterministic spatial primitives, spatial hashing, Morton encoding, and collision broad-phase algorithms.",
      "crate": {
        "package": "spatial-kernels",
        "manifest": "crates/spatial-kernels/Cargo.toml"
      },
      "tags": [
        "spatial",
        "collision",
        "broad-phase",
        "spatial-hash",
        "morton",
        "z-order"
      ],
      "dependencies": [],
      "registryDependencies": [],
      "files": [
        {
          "path": "crates/spatial-kernels/Cargo.toml",
          "target": "crates/spatial-kernels/Cargo.toml"
        },
        {
          "path": "crates/spatial-kernels/src/lib.rs",
          "target": "crates/spatial-kernels/src/lib.rs"
        },
        {
          "path": "crates/spatial-kernels/src/morton.rs",
          "target": "crates/spatial-kernels/src/morton.rs"
        },
        {
          "path": "crates/spatial-kernels/src/spatial_hash.rs",
          "target": "crates/spatial-kernels/src/spatial_hash.rs"
        }
      ],
      "provides": [
        {
          "name": "aabb",
          "type": "data-structure",
          "symbols": [
            "Aabb",
            "Body",
            "ColliderId"
          ]
        },
        {
          "name": "pair",
          "type": "data-structure",
          "symbols": [
            "Pair"
          ]
        },
        {
          "name": "spatial-hash-3d",
          "type": "data-structure",
          "symbols": [
            "CellCoord3",
            "SpatialHash3D"
          ]
        },
        {
          "name": "morton-2d",
          "type": "algorithm",
          "symbols": [
            "morton2_encode",
            "morton2_decode"
          ]
        },
        {
          "name": "morton-3d",
          "type": "algorithm",
          "symbols": [
            "morton3_encode",
            "morton3_decode",
            "MORTON_3D_BITS_PER_AXIS",
            "MORTON_3D_MAX_COORD"
          ]
        },
        {
          "name": "broad-phase",
          "type": "interface",
          "symbols": [
            "BroadPhase",
            "BroadPhaseResult",
            "BroadPhaseStats"
          ]
        },
        {
          "name": "naive-broad-phase",
          "type": "algorithm",
          "symbols": [
            "NaiveBroadPhase"
          ]
        },
        {
          "name": "uniform-grid-broad-phase",
          "type": "algorithm",
          "symbols": [
            "UniformGridBroadPhase"
          ]
        }
      ]
    },
    {
      "name": "collection-kernels",
      "type": "registry:crate",
      "title": "Collection Kernels",
      "description": "Small deterministic collection and data-structure kernels.",
      "crate": {
        "package": "collection-kernels",
        "manifest": "crates/collection-kernels/Cargo.toml"
      },
      "tags": [
        "collections",
        "connectivity",
        "data-structures",
        "streaming",
        "ecs-primitives",
        "bitset",
        "arena",
        "generational-handles",
        "fenwick-tree",
        "prefix-sum",
        "lru-cache"
      ],
      "dependencies": [],
      "registryDependencies": [],
      "files": [
        {
          "path": "crates/collection-kernels/Cargo.toml",
          "target": "crates/collection-kernels/Cargo.toml"
        },
        {
          "path": "crates/collection-kernels/src/lib.rs",
          "target": "crates/collection-kernels/src/lib.rs"
        },
        {
          "path": "crates/collection-kernels/src/bit_set.rs",
          "target": "crates/collection-kernels/src/bit_set.rs"
        },
        {
          "path": "crates/collection-kernels/src/fenwick_tree.rs",
          "target": "crates/collection-kernels/src/fenwick_tree.rs"
        },
        {
          "path": "crates/collection-kernels/src/generational_arena.rs",
          "target": "crates/collection-kernels/src/generational_arena.rs"
        },
        {
          "path": "crates/collection-kernels/src/lru_cache.rs",
          "target": "crates/collection-kernels/src/lru_cache.rs"
        },
        {
          "path": "crates/collection-kernels/src/ring_buffer.rs",
          "target": "crates/collection-kernels/src/ring_buffer.rs"
        },
        {
          "path": "crates/collection-kernels/src/sparse_set.rs",
          "target": "crates/collection-kernels/src/sparse_set.rs"
        },
        {
          "path": "crates/collection-kernels/src/union_find.rs",
          "target": "crates/collection-kernels/src/union_find.rs"
        },
        {
          "path": "crates/collection-kernels/src/addressable_priority_queue.rs",
          "target": "crates/collection-kernels/src/addressable_priority_queue.rs"
        },
        {
          "path": "crates/collection-kernels/benches/addressable_priority_queue.rs",
          "target": "crates/collection-kernels/benches/addressable_priority_queue.rs"
        },
        {
          "path": "crates/collection-kernels/benches/fenwick_tree.rs",
          "target": "crates/collection-kernels/benches/fenwick_tree.rs"
        },
        {
          "path": "crates/collection-kernels/benches/lru_cache.rs",
          "target": "crates/collection-kernels/benches/lru_cache.rs"
        },
        {
          "path": "crates/collection-kernels/benches/ring_buffer.rs",
          "target": "crates/collection-kernels/benches/ring_buffer.rs"
        }
      ],
      "provides": [
        {
          "name": "union-find",
          "type": "data-structure",
          "symbols": [
            "UnionFind"
          ]
        },
        {
          "name": "ring-buffer",
          "type": "data-structure",
          "symbols": [
            "RingBuffer"
          ]
        },
        {
          "name": "sparse-set",
          "type": "data-structure",
          "symbols": [
            "SparseSet"
          ]
        },
        {
          "name": "bit-set",
          "type": "data-structure",
          "symbols": [
            "BitSet",
            "BitSetIter"
          ]
        },
        {
          "name": "generational-arena",
          "type": "data-structure",
          "symbols": [
            "ArenaKey",
            "GenerationalArena"
          ]
        },
        {
          "name": "fenwick-tree",
          "type": "data-structure",
          "symbols": [
            "FenwickTree"
          ]
        },
        {
          "name": "lru-cache",
          "type": "data-structure",
          "symbols": [
            "LruCache"
          ]
        }
      ]
    },
    {
      "name": "graph-kernels",
      "type": "registry:crate",
      "title": "Graph Kernels",
      "description": "Graph algorithms that accept caller-owned graph storage through callbacks or edge lists.",
      "crate": {
        "package": "graph-kernels",
        "manifest": "crates/graph-kernels/Cargo.toml"
      },
      "tags": [
        "graph",
        "pathfinding",
        "search",
        "traversal",
        "topology",
        "minimum-spanning-tree",
        "kruskal",
        "pagerank",
        "flow",
        "min-cut",
        "bipartite-matching",
        "assignment"
      ],
      "dependencies": [],
      "registryDependencies": [
        "collection-kernels"
      ],
      "files": [
        {
          "path": "crates/graph-kernels/Cargo.toml",
          "target": "crates/graph-kernels/Cargo.toml"
        },
        {
          "path": "crates/graph-kernels/src/lib.rs",
          "target": "crates/graph-kernels/src/lib.rs"
        },
        {
          "path": "crates/graph-kernels/src/minimum_spanning.rs",
          "target": "crates/graph-kernels/src/minimum_spanning.rs"
        },
        {
          "path": "crates/graph-kernels/src/search.rs",
          "target": "crates/graph-kernels/src/search.rs"
        },
        {
          "path": "crates/graph-kernels/src/topology.rs",
          "target": "crates/graph-kernels/src/topology.rs"
        },
        {
          "path": "crates/graph-kernels/src/traversal.rs",
          "target": "crates/graph-kernels/src/traversal.rs"
        },
        {
          "path": "crates/graph-kernels/src/assignment.rs",
          "target": "crates/graph-kernels/src/assignment.rs"
        },
        {
          "path": "crates/graph-kernels/src/flow.rs",
          "target": "crates/graph-kernels/src/flow.rs"
        },
        {
          "path": "crates/graph-kernels/src/matching.rs",
          "target": "crates/graph-kernels/src/matching.rs"
        },
        {
          "path": "crates/graph-kernels/benches/minimum_spanning.rs",
          "target": "crates/graph-kernels/benches/minimum_spanning.rs"
        },
        {
          "path": "crates/graph-kernels/benches/page_rank.rs",
          "target": "crates/graph-kernels/benches/page_rank.rs"
        },
        {
          "path": "crates/graph-kernels/benches/topology.rs",
          "target": "crates/graph-kernels/benches/topology.rs"
        },
        {
          "path": "crates/graph-kernels/benches/shortest_path.rs",
          "target": "crates/graph-kernels/benches/shortest_path.rs"
        },
        {
          "path": "crates/graph-kernels/benches/boundary_cases.rs",
          "target": "crates/graph-kernels/benches/boundary_cases.rs"
        },
        {
          "path": "crates/graph-kernels/benches/optimization.rs",